IMDB ID,Start Timestamp,End Timestamp,Dialogue
tt1229238,"01:59:59,408","02:00:02,555",I know. I see you in Kandahar.
tt1229238,"02:00:05,827","02:00:08,127",Hey thanks for meeting me.
tt1229238,"02:00:08,127","02:00:10,784","So, I heard the insurance companies refused into pay the claim"
tt1229238,"02:00:10,785","02:00:12,783","on that car you crashed, Ethan."
tt1229238,"02:00:12,784","02:00:16,602",Something about intentional a hundred meters that could drop not being covered.
tt1229238,"02:00:16,611","02:00:18,334",Go figured.
tt1229238,"02:00:21,262","02:00:24,248",- How's the leg? - Still working.
tt1229238,"02:00:25,219","02:00:27,682",- You? - Healing.
tt1229238,"02:00:29,776","02:00:32,030","I'm fine, by the way."
tt1229238,"02:00:32,030","02:00:35,715","But I'm not actually sleeping per say, you know."
tt1229238,"02:00:35,715","02:00:37,437","Caught sweats, middle of the night."
tt1229238,"02:00:38,287","02:00:41,037","All these people are just happy and smiling,"
tt1229238,"02:00:41,037","02:00:45,266","and they are completely oblivious, for the fact they were almost...vaporized."
tt1229238,"02:00:46,104","02:00:49,408",- and if I've been inferred... - Dumb luck?
tt1229238,"02:00:49,931","02:00:51,244",Was it?
tt1229238,"02:00:52,247","02:00:55,990","I mean, look, we were unprepared, in the dark,"
tt1229238,"02:00:55,990","02:00:58,062",disavowed.
tt1229238,"02:00:58,570","02:01:00,841",The only thing that functioned properly
tt1229238,"02:01:01,317","02:01:03,590","on that mission,"
tt1229238,"02:01:04,049","02:01:06,214",was this team.
tt1229238,"02:01:07,330","02:01:09,978","I don't know how we ended up together,"
tt1229238,"02:01:11,874","02:01:14,254",but I'm glad we did.
tt1229238,"02:01:20,668","02:01:22,968",Your missions.
tt1229238,"02:01:22,968","02:01:25,519",Choose to accept them.
tt1229238,"02:01:30,177","02:01:31,836","all right ... you know, I am in."
tt1229238,"02:01:32,129","02:01:35,912","Seriously, this is not as hard as any mission gonna rougher than the last one, is it?"
tt1229238,"02:01:37,654","02:01:40,628","It's just ... a bomb, is it?"
tt1229238,"02:01:58,914","02:02:01,578","- Thanks, Ethan. - I thank you."
tt1229238,"02:02:03,710","02:02:06,622",- Agent Hunt. - Agent Carter.
tt1229238,"02:02:14,962","02:02:17,107",Brandt.
tt1229238,"02:02:19,202","02:02:23,767","I'm not picking up that phone Ethan, because I don't think you want me the field"
tt1229238,"02:02:26,522","02:02:29,193",I know your wife is dead.
tt1229238,"02:02:30,840","02:02:33,762",I was there in Croatia.
tt1229238,"02:02:34,656","02:02:37,367",I was there for one reason. One.
tt1229238,"02:02:38,392","02:02:40,724",And I failed.
tt1229238,"02:02:44,152","02:02:46,393",It was my job to protect her.
tt1229238,"02:02:46,393","02:02:49,326",How do you know she's dead?
tt1229238,"02:02:51,240","02:02:55,944",- where's the body? - Did you see it?
tt1229238,"02:02:57,690","02:03:00,786",- You killed those Serbians. - I had to get her back.
tt1229238,"02:03:00,786","02:03:02,632",You sent out to rankout prison.
tt1229238,"02:03:02,632","02:03:04,551",That was a sacrifice I'm willing to make.
tt1229238,"02:03:04,551","02:03:07,936",IMF suspected that Hendricks had people in rankout.
tt1229238,"02:03:10,233","02:03:13,299",And six dead Serbians was your idea of cover?
tt1229238,"02:03:14,567","02:03:17,346","I always not one, not"
tt1229238,"02:03:33,349","02:03:36,111",Secretary never told me.
tt1229238,"02:03:39,365","02:03:42,757",I accepted the direct call prison mission on one condition.
tt1229238,"02:03:42,757","02:03:45,994",No one can know she's still alive.
tt1229238,"02:03:46,518","02:03:49,568",But ... you telling me.
tt1229238,"02:03:56,925","02:03:59,945",When did you find out that I was in Croatia?
tt1229238,"02:04:00,046","02:04:04,400","- I put your file, after India. - Great."
tt1229238,"02:04:06,266","02:04:09,359","So, you had to fake your wife's death."
tt1229238,"02:04:09,911","02:04:13,158","As long as we're together, she can never be safe."
tt1229238,"02:04:13,926","02:04:16,744","It wasn't your job to protect her, Brandt."
tt1229238,"02:04:19,214","02:04:21,423",It's mine.
tt1229238,"02:04:27,608","02:04:31,539",- So we're good? - We're good.
tt1229238,"02:05:52,900","02:05:54,378","Good evening, Mr. Hunt."
tt1229238,"02:05:54,378","02:05:58,324","36 hours ago, there was a breach on military's communication network."
tt1229238,"02:05:58,324","02:06:02,982","Now, an emerging terror organization known as the Syndicate,"
tt1229238,"02:06:02,982","02:06:04,358",has control over entire drone fleet.
tt1229238,"02:06:04,358","02:06:11,093","Your targets: unknown. Your mission, should you choose to accept it..."
tt1229238,"02:06:11,093","02:06:28,093",Transcribed and Synchronized by; kucing_gaul a.k.a Nakashima_Tadayoshi nakashima.tadayoshi17@gmail.com
